Sheet: Options
A1: Symbol | B1: Date | C1: Expiry | D1: Option Type | E1: Settle Price | F1: Underlying Value | G1: Returns | H1: Strike Price | I1: Upwards | J1: Downwards | K1: So*u | L1: So*d | M1: fu | N1: fd | O1: Rf (%) | P1: Annualized Rf | Q1: p | R1: Theoretical option price | S1: Implied Volatility
A2: PVR | B2: 2018-10-01 | C2: 2018-12-27 | D2: CE | E2: 90.25 | F2: 1224.9 | H2: 1300 | I2: 1.124 | J2: 0.8897 | K2: of:=[.F2]*[.I2] -> 1376.7876 | L2: of:=[.F2]*[.J2] -> 1089.79353 | M2: of:=MAX(([.K2]-[.H2]);0) -> 76.7876000000003 | N2: of:=MAX(([.L2]-[.H2]);0) -> 0 | O2: 0.0192602739726027 | P2: of:=POWER(([.O2]/100)+1;365)-1 -> 0.0728227198890667 | Q2: of:=(EXP([.P2]*0.25)-[.J2])/([.I2]-[.J2]) -> 0.549178035255349 | R2: of:=EXP(-[.P2]*0.25)*([.Q2]*[.M2]+(1-[.Q2])*[.N2]) -> 41.4092749708353 | S2: of:=[.E2]-[.R2] -> 48.8407250291647
A3: PVR | B3: 2018-10-03 | C3: 2018-12-27 | D3: CE | E3: 86.8 | F3: 1227.85 | G3: of:=([.F3]-[.F2])/[.F2] -> 0.00240835986611137 | H3: 1300 | I3: 1.124 | J3: 0.8897 | K3: of:=[.F3]*[.I3] -> 1380.1034 | L3: of:=[.F3]*[.J3] -> 1092.418145 | M3: of:=MAX(([.K3]-[.H3]);0) -> 80.1034 | N3: of:=MAX(([.L3]-[.H3]);0) -> 0 | O3: 0.0192328767123288 | P3: of:=POWER(([.O3]/100)+1;365)-1 -> 0.0727154636231044 | Q3: of:=(EXP([.P3]*0.25)-[.J3])/([.I3]-[.J3]) -> 0.549061490912568 | R3: of:=EXP(-[.P3]*0.25)*([.Q3]*[.M3]+(1-[.Q3])*[.N3]) -> 43.1893784484104 | S3: of:=[.E3]-[.R3] -> 43.6106215515896
A4: PVR | B4: 2018-10-04 | C4: 2018-12-27 | D4: CE | E4: 73.2 | F4: 1199.55 | G4: of:=([.F4]-[.F3])/[.F3] -> -0.0230484179663639 | H4: 1300 | I4: 1.124 | J4: 0.8897 | K4: of:=[.F4]*[.I4] -> 1348.2942 | L4: of:=[.F4]*[.J4] -> 1067.239635 | M4: of:=MAX(([.K4]-[.H4]);0) -> 48.2942 | N4: of:=MAX(([.L4]-[.H4]);0) -> 0 | O4: 0.0195068493150685 | P4: of:=POWER(([.O4]/100)+1;365)-1 -> 0.07378850767218 | Q4: of:=(EXP([.P4]*0.25)-[.J4])/([.I4]-[.J4]) -> 0.550227598188217 | R4: of:=EXP(-[.P4]*0.25)*([.Q4]*[.M4]+(1-[.Q4])*[.N4]) -> 26.0871034689751 | S4: of:=[.E4]-[.R4] -> 47.1128965310249
A5: PVR | B5: 2018-10-05 | C5: 2018-12-27 | D5: CE | E5: 60.5 | F5: 1168.3 | G5: of:=([.F5]-[.F4])/[.F4] -> -0.0260514359551498 | H5: 1300 | I5: 1.124 | J5: 0.8897 | K5: of:=[.F5]*[.I5] -> 1313.1692 | L5: of:=[.F5]*[.J5] -> 1039.43651 | M5: of:=MAX(([.K5]-[.H5]);0) -> 13.1692 | N5: of:=MAX(([.L5]-[.H5]);0) -> 0 | O5: 0.018986301369863 | P5: of:=POWER(([.O5]/100)+1;365)-1 -> 0.0717506383165367 | Q5: of:=(EXP([.P5]*0.25)-[.J5])/([.I5]-[.J5]) -> 0.54801325505656 | R5: of:=EXP(-[.P5]*0.25)*([.Q5]*[.M5]+(1-[.Q5])*[.N5]) -> 7.08859607373462 | S5: of:=[.E5]-[.R5] -> 53.4114039262654
A6: PVR | B6: 2018-10-08 | C6: 2018-12-27 | D6: CE | E6: 60.4 | F6: 1179.8 | G6: of:=([.F6]-[.F5])/[.F5] -> 0.00984336215013267 | H6: 1300 | I6: 1.124 | J6: 0.8897 | K6: of:=[.F6]*[.I6] -> 1326.0952 | L6: of:=[.F6]*[.J6] -> 1049.66806 | M6: of:=MAX(([.K6]-[.H6]);0) -> 26.0952 | N6: of:=MAX(([.L6]-[.H6]);0) -> 0 | O6: 0.0189315068493151 | P6: of:=POWER(([.O6]/100)+1;365)-1 -> 0.0715363502449966 | Q6: of:=(EXP([.P6]*0.25)-[.J6])/([.I6]-[.J6]) -> 0.54778047578213 | R6: of:=EXP(-[.P6]*0.25)*([.Q6]*[.M6]+(1-[.Q6])*[.N6]) -> 14.0410704402921 | S6: of:=[.E6]-[.R6] -> 46.3589295597079
A7: PVR | B7: 2018-10-09 | C7: 2018-12-27 | D7: CE | E7: 71.35 | F7: 1208 | G7: of:=([.F7]-[.F6])/[.F6] -> 0.0239023563315817 | H7: 1300 | I7: 1.124 | J7: 0.8897 | K7: of:=[.F7]*[.I7] -> 1357.792 | L7: of:=[.F7]*[.J7] -> 1074.7576 | M7: of:=MAX(([.K7]-[.H7]);0) -> 57.7920000000001 | N7: of:=MAX(([.L7]-[.H7]);0) -> 0 | O7: 0.0188219178082192 | P7: of:=POWER(([.O7]/100)+1;365)-1 -> 0.0711079022771317 | Q7: of:=(EXP([.P7]*0.25)-[.J7])/([.I7]-[.J7]) -> 0.547315093859946 | R7: of:=EXP(-[.P7]*0.25)*([.Q7]*[.M7]+(1-[.Q7])*[.N7]) -> 31.0731089071368 | S7: of:=[.E7]-[.R7] -> 40.2768910928631
A8: PVR | B8: 2018-10-10 | C8: 2018-12-27 | D8: CE | E8: 138.7 | F8: 1297.2 | G8: of:=([.F8]-[.F7])/[.F7] -> 0.073841059602649 | H8: 1300 | I8: 1.124 | J8: 0.8897 | K8: of:=[.F8]*[.I8] -> 1458.0528 | L8: of:=[.F8]*[.J8] -> 1154.11884 | M8: of:=MAX(([.K8]-[.H8]);0) -> 158.0528 | N8: of:=MAX(([.L8]-[.H8]);0) -> 0 | O8: 0.018958904109589 | P8: of:=POWER(([.O8]/100)+1;365)-1 -> 0.0716434889392548 | Q8: of:=(EXP([.P8]*0.25)-[.J8])/([.I8]-[.J8]) -> 0.5478968580581 | R8: of:=EXP(-[.P8]*0.25)*([.Q8]*[.M8]+(1-[.Q8])*[.N8]) -> 85.0594188198228 | S8: of:=[.E8]-[.R8] -> 53.6405811801772
A9: PVR | B9: 2018-10-11 | C9: 2018-12-27 | D9: CE | E9: 116.55 | F9: 1257 | G9: of:=([.F9]-[.F8])/[.F8] -> -0.0309898242368178 | H9: 1300 | I9: 1.124 | J9: 0.8897 | K9: of:=[.F9]*[.I9] -> 1412.868 | L9: of:=[.F9]*[.J9] -> 1118.3529 | M9: of:=MAX(([.K9]-[.H9]);0) -> 112.868 | N9: of:=MAX(([.L9]-[.H9]);0) -> 0 | O9: 0.019013698630137 | P9: of:=POWER(([.O9]/100)+1;365)-1 -> 0.0718577983778177 | Q9: of:=(EXP([.P9]*0.25)-[.J9])/([.I9]-[.J9]) -> 0.548129666779586 | R9: of:=EXP(-[.P9]*0.25)*([.Q9]*[.M9]+(1-[.Q9])*[.N9]) -> 60.7648284958995 | S9: of:=[.E9]-[.R9] -> 55.7851715041005
A10: PVR | B10: 2018-10-12 | C10: 2018-12-27 | D10: CE | E10: 161.65 | F10: 1323.95 | G10: of:=([.F10]-[.F9])/[.F9] -> 0.0532617342879873 | H10: 1300 | I10: 1.124 | J10: 0.8897 | K10: of:=[.F10]*[.I10] -> 1488.1198 | L10: of:=[.F10]*[.J10] -> 1177.918315 | M10: of:=MAX(([.K10]-[.H10]);0) -> 188.1198 | N10: of:=MAX(([.L10]-[.H10]);0) -> 0 | O10: 0.0188767123287671 | P10: of:=POWER(([.O10]/100)+1;365)-1 -> 0.0713221049013895 | Q10: of:=(EXP([.P10]*0.25)-[.J10])/([.I10]-[.J10]) -> 0.547547755389075 | R10: of:=EXP(-[.P10]*0.25)*([.Q10]*[.M10]+(1-[.Q10])*[.N10]) -> 101.184225587184 | S10: of:=[.E10]-[.R10] -> 60.4657744128165
A11: PVR | B11: 2018-10-15 | C11: 2018-12-27 | D11: CE | E11: 146.7 | F11: 1310.05 | G11: of:=([.F11]-[.F10])/[.F10] -> -0.0104988859095888 | H11: 1300 | I11: 1.124 | J11: 0.8897 | K11: of:=[.F11]*[.I11] -> 1472.4962 | L11: of:=[.F11]*[.J11] -> 1165.551485 | M11: of:=MAX(([.K11]-[.H11]);0) -> 172.4962 | N11: of:=MAX(([.L11]-[.H11]);0) -> 0 | O11: 0.0189315068493151 | P11: of:=POWER(([.O11]/100)+1;365)-1 -> 0.0715363502449966 | Q11: of:=(EXP([.P11]*0.25)-[.J11])/([.I11]-[.J11]) -> 0.54778047578213 | R11: of:=EXP(-[.P11]*0.25)*([.Q11]*[.M11]+(1-[.Q11])*[.N11]) -> 92.8152033662406 | S11: of:=[.E11]-[.R11] -> 53.8847966337594
A12: PVR | B12: 2018-10-16 | C12: 2018-12-27 | D12: CE | E12: 162.85 | F12: 1341 | G12: of:=([.F12]-[.F11])/[.F11] -> 0.0236250524789131 | H12: 1300 | I12: 1.124 | J12: 0.8897 | K12: of:=[.F12]*[.I12] -> 1507.284 | L12: of:=[.F12]*[.J12] -> 1193.0877 | M12: of:=MAX(([.K12]-[.H12]);0) -> 207.284 | N12: of:=MAX(([.L12]-[.H12]);0) -> 0 | O12: 0.018986301369863 | P12: of:=POWER(([.O12]/100)+1;365)-1 -> 0.0717506383165367 | Q12: of:=(EXP([.P12]*0.25)-[.J12])/([.I12]-[.J12]) -> 0.54801325505656 | R12: of:=EXP(-[.P12]*0.25)*([.Q12]*[.M12]+(1-[.Q12])*[.N12]) -> 111.574928511072 | S12: of:=[.E12]-[.R12] -> 51.2750714889285
A13: PVR | B13: 2018-10-17 | C13: 2018-12-27 | D13: CE | E13: 143.45 | F13: 1314 | G13: of:=([.F13]-[.F12])/[.F12] -> -0.0201342281879195 | H13: 1300 | I13: 1.124 | J13: 0.8897 | K13: of:=[.F13]*[.I13] -> 1476.936 | L13: of:=[.F13]*[.J13] -> 1169.0658 | M13: of:=MAX(([.K13]-[.H13]);0) -> 176.936 | N13: of:=MAX(([.L13]-[.H13]);0) -> 0 | O13: 0.018958904109589 | P13: of:=POWER(([.O13]/100)+1;365)-1 -> 0.0716434889392548 | Q13: of:=(EXP([.P13]*0.25)-[.J13])/([.I13]-[.J13]) -> 0.5478968580581 | R13: of:=EXP(-[.P13]*0.25)*([.Q13]*[.M13]+(1-[.Q13])*[.N13]) -> 95.2218077016299 | S13: of:=[.E13]-[.R13] -> 48.2281922983701
A14: PVR | B14: 2018-10-19 | C14: 2018-12-27 | D14: CE | E14: 125.6 | F14: 1290.35 | G14: of:=([.F14]-[.F13])/[.F13] -> -0.0179984779299848 | H14: 1300 | I14: 1.124 | J14: 0.8897 | K14: of:=[.F14]*[.I14] -> 1450.3534 | L14: of:=[.F14]*[.J14] -> 1148.024395 | M14: of:=MAX(([.K14]-[.H14]);0) -> 150.3534 | N14: of:=MAX(([.L14]-[.H14]);0) -> 0 | O14: 0.019041095890411 | P14: of:=POWER(([.O14]/100)+1;365)-1 -> 0.0719649691243338 | Q14: of:=(EXP([.P14]*0.25)-[.J14])/([.I14]-[.J14]) -> 0.548246093229536 | R14: of:=EXP(-[.P14]*0.25)*([.Q14]*[.M14]+(1-[.Q14])*[.N14]) -> 80.9608952329137 | S14: of:=[.E14]-[.R14] -> 44.6391047670863
A15: PVR | B15: 2018-10-22 | C15: 2018-12-27 | D15: CE | E15: 124.1 | F15: 1299.15 | G15: of:=([.F15]-[.F14])/[.F14] -> 0.00681985507807973 | H15: 1300 | I15: 1.124 | J15: 0.8897 | K15: of:=[.F15]*[.I15] -> 1460.2446 | L15: of:=[.F15]*[.J15] -> 1155.853755 | M15: of:=MAX(([.K15]-[.H15]);0) -> 160.2446 | N15: of:=MAX(([.L15]-[.H15]);0) -> 0 | O15: 0.019041095890411 | P15: of:=POWER(([.O15]/100)+1;365)-1 -> 0.0719649691243338 | Q15: of:=(EXP([.P15]*0.25)-[.J15])/([.I15]-[.J15]) -> 0.548246093229536 | R15: of:=EXP(-[.P15]*0.25)*([.Q15]*[.M15]+(1-[.Q15])*[.N15]) -> 86.2870162712661 | S15: of:=[.E15]-[.R15] -> 37.8129837287339
A16: PVR | B16: 2018-10-23 | C16: 2018-12-27 | D16: CE | E16: 109.9 | F16: 1279.65 | G16: of:=([.F16]-[.F15])/[.F15] -> -0.0150098141092253 | H16: 1300 | I16: 1.124 | J16: 0.8897 | K16: of:=[.F16]*[.I16] -> 1438.3266 | L16: of:=[.F16]*[.J16] -> 1138.504605 | M16: of:=MAX(([.K16]-[.H16]);0) -> 138.3266 | N16: of:=MAX(([.L16]-[.H16]);0) -> 0 | O16: 0.0190684931506849 | P16: of:=POWER(([.O16]/100)+1;365)-1 -> 0.0720721505569739 | Q16: of:=(EXP([.P16]*0.25)-[.J16])/([.I16]-[.J16]) -> 0.548362534408394 | R16: of:=EXP(-[.P16]*0.25)*([.Q16]*[.M16]+(1-[.Q16])*[.N16]) -> 74.4986397188474 | S16: of:=[.E16]-[.R16] -> 35.4013602811526
A17: PVR | B17: 2018-10-24 | C17: 2018-12-27 | D17: CE | E17: 107.6 | F17: 1283.25 | G17: of:=([.F17]-[.F16])/[.F16] -> 0.00281326925331138 | H17: 1300 | I17: 1.124 | J17: 0.8897 | K17: of:=[.F17]*[.I17] -> 1442.373 | L17: of:=[.F17]*[.J17] -> 1141.707525 | M17: of:=MAX(([.K17]-[.H17]);0) -> 142.373 | N17: of:=MAX(([.L17]-[.H17]);0) -> 0 | O17: 0.019041095890411 | P17: of:=POWER(([.O17]/100)+1;365)-1 -> 0.0719649691243338 | Q17: of:=(EXP([.P17]*0.25)-[.J17])/([.I17]-[.J17]) -> 0.548246093229536 | R17: of:=EXP(-[.P17]*0.25)*([.Q17]*[.M17]+(1-[.Q17])*[.N17]) -> 76.6636839406067 | S17: of:=[.E17]-[.R17] -> 30.9363160593932
A18: PVR | B18: 2018-10-25 | C18: 2018-12-27 | D18: CE | E18: 103.8 | F18: 1284.05 | G18: of:=([.F18]-[.F17])/[.F17] -> 0.000623417105006783 | H18: 1300 | I18: 1.124 | J18: 0.8897 | K18: of:=[.F18]*[.I18] -> 1443.2722 | L18: of:=[.F18]*[.J18] -> 1142.419285 | M18: of:=MAX(([.K18]-[.H18]);0) -> 143.2722 | N18: of:=MAX(([.L18]-[.H18]);0) -> 0 | O18: 0.0190684931506849 | P18: of:=POWER(([.O18]/100)+1;365)-1 -> 0.0720721505569739 | Q18: of:=(EXP([.P18]*0.25)-[.J18])/([.I18]-[.J18]) -> 0.548362534408394 | R18: of:=EXP(-[.P18]*0.25)*([.Q18]*[.M18]+(1-[.Q18])*[.N18]) -> 77.1621944696582 | S18: of:=[.E18]-[.R18] -> 26.6378055303418
A19: PVR | B19: 2018-10-26 | C19: 2018-12-27 | D19: CE | E19: 106.2 | F19: 1295.1 | G19: of:=([.F19]-[.F18])/[.F18] -> 0.00860558389470812 | H19: 1300 | I19: 1.124 | J19: 0.8897 | K19: of:=[.F19]*[.I19] -> 1455.6924 | L19: of:=[.F19]*[.J19] -> 1152.25047 | M19: of:=MAX(([.K19]-[.H19]);0) -> 155.6924 | N19: of:=MAX(([.L19]-[.H19]);0) -> 0 | O19: 0.019041095890411 | P19: of:=POWER(([.O19]/100)+1;365)-1 -> 0.0719649691243338 | Q19: of:=(EXP([.P19]*0.25)-[.J19])/([.I19]-[.J19]) -> 0.548246093229536 | R19: of:=EXP(-[.P19]*0.25)*([.Q19]*[.M19]+(1-[.Q19])*[.N19]) -> 83.8357901115698 | S19: of:=[.E19]-[.R19] -> 22.3642098884302
A20: PVR | B20: 2018-10-29 | C20: 2018-12-27 | D20: CE | E20: 114.6 | F20: 1317.4 | G20: of:=([.F20]-[.F19])/[.F19] -> 0.0172187475870591 | H20: 1300 | I20: 1.124 | J20: 0.8897 | K20: of:=[.F20]*[.I20] -> 1480.7576 | L20: of:=[.F20]*[.J20] -> 1172.09078 | M20: of:=MAX(([.K20]-[.H20]);0) -> 180.7576 | N20: of:=MAX(([.L20]-[.H20]);0) -> 0 | O20: 0.019041095890411 | P20: of:=POWER(([.O20]/100)+1;365)-1 -> 0.0719649691243338 | Q20: of:=(EXP([.P20]*0.25)-[.J20])/([.I20]-[.J20]) -> 0.548246093229536 | R20: of:=EXP(-[.P20]*0.25)*([.Q20]*[.M20]+(1-[.Q20])*[.N20]) -> 97.3326650155762 | S20: of:=[.E20]-[.R20] -> 17.2673349844238
A21: PVR | B21: 2018-10-30 | C21: 2018-12-27 | D21: CE | E21: 126.1 | F21: 1340.25 | G21: of:=([.F21]-[.F20])/[.F20] -> 0.0173447700015181 | H21: 1300 | I21: 1.124 | J21: 0.8897 | K21: of:=[.F21]*[.I21] -> 1506.441 | L21: of:=[.F21]*[.J21] -> 1192.420425 | M21: of:=MAX(([.K21]-[.H21]);0) -> 206.441 | N21: of:=MAX(([.L21]-[.H21]);0) -> 0 | O21: 0.0190684931506849 | P21: of:=POWER(([.O21]/100)+1;365)-1 -> 0.0720721505569739 | Q21: of:=(EXP([.P21]*0.25)-[.J21])/([.I21]-[.J21]) -> 0.548362534408394 | R21: of:=EXP(-[.P21]*0.25)*([.Q21]*[.M21]+(1-[.Q21])*[.N21]) -> 111.183052877744 | S21: of:=[.E21]-[.R21] -> 14.9169471222559
A22: PVR | B22: 2018-10-31 | C22: 2018-12-27 | D22: CE | E22: 137.95 | F22: 1362.35 | G22: of:=([.F22]-[.F21])/[.F21] -> 0.0164894609214698 | H22: 1300 | I22: 1.124 | J22: 0.8897 | K22: of:=[.F22]*[.I22] -> 1531.2814 | L22: of:=[.F22]*[.J22] -> 1212.082795 | M22: of:=MAX(([.K22]-[.H22]);0) -> 231.2814 | N22: of:=MAX(([.L22]-[.H22]);0) -> 0 | O22: 0.019041095890411 | P22: of:=POWER(([.O22]/100)+1;365)-1 -> 0.0719649691243338 | Q22: of:=(EXP([.P22]*0.25)-[.J22])/([.I22]-[.J22]) -> 0.548246093229536 | R22: of:=EXP(-[.P22]*0.25)*([.Q22]*[.M22]+(1-[.Q22])*[.N22]) -> 124.538249183069 | S22: of:=[.E22]-[.R22] -> 13.4117508169312
A23: PVR | B23: 2018-11-01 | C23: 2018-12-27 | D23: CE | E23: 138.8 | F23: 1368.85 | G23: of:=([.F23]-[.F22])/[.F22] -> 0.00477116746797813 | H23: 1300 | I23: 1.124 | J23: 0.8897 | K23: of:=[.F23]*[.I23] -> 1538.5874 | L23: of:=[.F23]*[.J23] -> 1217.865845 | M23: of:=MAX(([.K23]-[.H23]);0) -> 238.5874 | N23: of:=MAX(([.L23]-[.H23]);0) -> 0 | O23: 0.018986301369863 | P23: of:=POWER(([.O23]/100)+1;365)-1 -> 0.0717506383165367 | Q23: of:=(EXP([.P23]*0.25)-[.J23])/([.I23]-[.J23]) -> 0.54801325505656 | R23: of:=EXP(-[.P23]*0.25)*([.Q23]*[.M23]+(1-[.Q23])*[.N23]) -> 128.424635276444 | S23: of:=[.E23]-[.R23] -> 10.375364723556
A24: PVR | B24: 2018-11-02 | C24: 2018-12-27 | D24: CE | E24: 154.75 | F24: 1394.4 | G24: of:=([.F24]-[.F23])/[.F23] -> 0.0186653029915624 | H24: 1300 | I24: 1.124 | J24: 0.8897 | K24: of:=[.F24]*[.I24] -> 1567.3056 | L24: of:=[.F24]*[.J24] -> 1240.59768 | M24: of:=MAX(([.K24]-[.H24]);0) -> 267.3056 | N24: of:=MAX(([.L24]-[.H24]);0) -> 0 | O24: 0.0190684931506849 | P24: of:=POWER(([.O24]/100)+1;365)-1 -> 0.0720721505569739 | Q24: of:=(EXP([.P24]*0.25)-[.J24])/([.I24]-[.J24]) -> 0.548362534408394 | R24: of:=EXP(-[.P24]*0.25)*([.Q24]*[.M24]+(1-[.Q24])*[.N24]) -> 143.962936913293 | S24: of:=[.E24]-[.R24] -> 10.7870630867071
A25: PVR | B25: 2018-11-05 | C25: 2018-12-27 | D25: CE | E25: 171.15 | F25: 1421.15 | G25: of:=([.F25]-[.F24])/[.F24] -> 0.0191838783706254 | H25: 1300 | I25: 1.124 | J25: 0.8897 | K25: of:=[.F25]*[.I25] -> 1597.3726 | L25: of:=[.F25]*[.J25] -> 1264.397155 | M25: of:=MAX(([.K25]-[.H25]);0) -> 297.3726 | N25: of:=MAX(([.L25]-[.H25]);0) -> 0 | O25: 0.018958904109589 | P25: of:=POWER(([.O25]/100)+1;365)-1 -> 0.0716434889392548 | Q25: of:=(EXP([.P25]*0.25)-[.J25])/([.I25]-[.J25]) -> 0.5478968580581 | R25: of:=EXP(-[.P25]*0.25)*([.Q25]*[.M25]+(1-[.Q25])*[.N25]) -> 160.037282028155 | S25: of:=[.E25]-[.R25] -> 11.1127179718447
A26: PVR | B26: 2018-11-06 | C26: 2018-12-27 | D26: CE | E26: 156.35 | F26: 1404.8 | G26: of:=([.F26]-[.F25])/[.F25] -> -0.0115047672659467 | H26: 1300 | I26: 1.124 | J26: 0.8897 | K26: of:=[.F26]*[.I26] -> 1578.9952 | L26: of:=[.F26]*[.J26] -> 1249.85056 | M26: of:=MAX(([.K26]-[.H26]);0) -> 278.9952 | N26: of:=MAX(([.L26]-[.H26]);0) -> 0 | O26: 0.019013698630137 | P26: of:=POWER(([.O26]/100)+1;365)-1 -> 0.0718577983778177 | Q26: of:=(EXP([.P26]*0.25)-[.J26])/([.I26]-[.J26]) -> 0.548129666779586 | R26: of:=EXP(-[.P26]*0.25)*([.Q26]*[.M26]+(1-[.Q26])*[.N26]) -> 150.20285181964 | S26: of:=[.E26]-[.R26] -> 6.14714818035966
A27: PVR | B27: 2018-11-07 | C27: 2018-12-27 | D27: CE | E27: 163.3 | F27: 1417.45 | G27: of:=([.F27]-[.F26])/[.F26] -> 0.0090048405466971 | H27: 1300 | I27: 1.124 | J27: 0.8897 | K27: of:=[.F27]*[.I27] -> 1593.2138 | L27: of:=[.F27]*[.J27] -> 1261.105265 | M27: of:=MAX(([.K27]-[.H27]);0) -> 293.2138 | N27: of:=MAX(([.L27]-[.H27]);0) -> 0 | O27: 0.019041095890411 | P27: of:=POWER(([.O27]/100)+1;365)-1 -> 0.0719649691243338 | Q27: of:=(EXP([.P27]*0.25)-[.J27])/([.I27]-[.J27]) -> 0.548246093229536 | R27: of:=EXP(-[.P27]*0.25)*([.Q27]*[.M27]+(1-[.Q27])*[.N27]) -> 157.887029775479 | S27: of:=[.E27]-[.R27] -> 5.4129702245209
A28: PVR | B28: 2018-11-09 | C28: 2018-12-27 | D28: CE | E28: 184.45 | F28: 1446.75 | G28: of:=([.F28]-[.F27])/[.F27] -> 0.0206709231366185 | H28: 1300 | I28: 1.124 | J28: 0.8897 | K28: of:=[.F28]*[.I28] -> 1626.147 | L28: of:=[.F28]*[.J28] -> 1287.173475 | M28: of:=MAX(([.K28]-[.H28]);0) -> 326.147 | N28: of:=MAX(([.L28]-[.H28]);0) -> 0 | O28: 0.018958904109589 | P28: of:=POWER(([.O28]/100)+1;365)-1 -> 0.0716434889392548 | Q28: of:=(EXP([.P28]*0.25)-[.J28])/([.I28]-[.J28]) -> 0.5478968580581 | R28: of:=EXP(-[.P28]*0.25)*([.Q28]*[.M28]+(1-[.Q28])*[.N28]) -> 175.522826990909 | S28: of:=[.E28]-[.R28] -> 8.92717300909101
A29: PVR | B29: 2018-11-12 | C29: 2018-12-27 | D29: CE | E29: 141.75 | F29: 1387.25 | G29: of:=([.F29]-[.F28])/[.F28] -> -0.0411266632106446 | H29: 1300 | I29: 1.124 | J29: 0.8897 | K29: of:=[.F29]*[.I29] -> 1559.269 | L29: of:=[.F29]*[.J29] -> 1234.236325 | M29: of:=MAX(([.K29]-[.H29]);0) -> 259.269 | N29: of:=MAX(([.L29]-[.H29]);0) -> 0 | O29: 0.018986301369863 | P29: of:=POWER(([.O29]/100)+1;365)-1 -> 0.0717506383165367 | Q29: of:=(EXP([.P29]*0.25)-[.J29])/([.I29]-[.J29]) -> 0.54801325505656 | R29: of:=EXP(-[.P29]*0.25)*([.Q29]*[.M29]+(1-[.Q29])*[.N29]) -> 139.556937053207 | S29: of:=[.E29]-[.R29] -> 2.19306294679274
A30: PVR | B30: 2018-11-13 | C30: 2018-12-27 | D30: CE | E30: 145.95 | F30: 1397.15 | G30: of:=([.F30]-[.F29])/[.F29] -> 0.00713642097675263 | H30: 1300 | I30: 1.124 | J30: 0.8897 | K30: of:=[.F30]*[.I30] -> 1570.3966 | L30: of:=[.F30]*[.J30] -> 1243.044355 | M30: of:=MAX(([.K30]-[.H30]);0) -> 270.3966 | N30: of:=MAX(([.L30]-[.H30]);0) -> 0 | O30: 0.0189315068493151 | P30: of:=POWER(([.O30]/100)+1;365)-1 -> 0.0715363502449966 | Q30: of:=(EXP([.P30]*0.25)-[.J30])/([.I30]-[.J30]) -> 0.54778047578213 | R30: of:=EXP(-[.P30]*0.25)*([.Q30]*[.M30]+(1-[.Q30])*[.N30]) -> 145.492569798871 | S30: of:=[.E30]-[.R30] -> 0.457430201128858
A31: PVR | B31: 2018-11-14 | C31: 2018-12-27 | D31: CE | E31: 161 | F31: 1419.7 | G31: of:=([.F31]-[.F30])/[.F30] -> 0.0161399992842572 | H31: 1300 | I31: 1.124 | J31: 0.8897 | K31: of:=[.F31]*[.I31] -> 1595.7428 | L31: of:=[.F31]*[.J31] -> 1263.10709 | M31: of:=MAX(([.K31]-[.H31]);0) -> 295.7428 | N31: of:=MAX(([.L31]-[.H31]);0) -> 0 | O31: 0.0187397260273973 | P31: of:=POWER(([.O31]/100)+1;365)-1 -> 0.070786678420901 | Q31: of:=(EXP([.P31]*0.25)-[.J31])/([.I31]-[.J31]) -> 0.546966211898124 | R31: of:=EXP(-[.P31]*0.25)*([.Q31]*[.M31]+(1-[.Q31])*[.N31]) -> 158.923863204274 | S31: of:=[.E31]-[.R31] -> 2.07613679572646
A32: PVR | B32: 2018-11-15 | C32: 2018-12-27 | D32: CE | E32: 151.05 | F32: 1410.15 | G32: of:=([.F32]-[.F31])/[.F31] -> -0.00672677326195672 | H32: 1300 | I32: 1.124 | J32: 0.8897 | K32: of:=[.F32]*[.I32] -> 1585.0086 | L32: of:=[.F32]*[.J32] -> 1254.610455 | M32: of:=MAX(([.K32]-[.H32]);0) -> 285.0086 | N32: of:=MAX(([.L32]-[.H32]);0) -> 0 | O32: 0.0186849315068493 | P32: of:=POWER(([.O32]/100)+1;365)-1 -> 0.0705725825578571 | Q32: of:=(EXP([.P32]*0.25)-[.J32])/([.I32]-[.J32]) -> 0.546733697452932 | R32: of:=EXP(-[.P32]*0.25)*([.Q32]*[.M32]+(1-[.Q32])*[.N32]) -> 153.098694046025 | S32: of:=[.E32]-[.R32] -> -2.04869404602536
A33: PVR | B33: 2018-11-16 | C33: 2018-12-27 | D33: CE | E33: 153.7 | F33: 1417 | G33: of:=([.F33]-[.F32])/[.F32] -> 0.00485763925823488 | H33: 1300 | I33: 1.124 | J33: 0.8897 | K33: of:=[.F33]*[.I33] -> 1592.708 | L33: of:=[.F33]*[.J33] -> 1260.7049 | M33: of:=MAX(([.K33]-[.H33]);0) -> 292.708 | N33: of:=MAX(([.L33]-[.H33]);0) -> 0 | O33: 0.0187671232876712 | P33: of:=POWER(([.O33]/100)+1;365)-1 -> 0.0708937423637293 | Q33: of:=(EXP([.P33]*0.25)-[.J33])/([.I33]-[.J33]) -> 0.547082491177398 | R33: of:=EXP(-[.P33]*0.25)*([.Q33]*[.M33]+(1-[.Q33])*[.N33]) -> 157.322274945217 | S33: of:=[.E33]-[.R33] -> -3.62227494521733 | Y33: Standard deviation | Z33: of:=COM.MICROSOFT.STDEV.S([.G3:.G64]) -> 0.0204106105066963
A34: PVR | B34: 2018-11-19 | C34: 2018-12-27 | D34: CE | E34: 163.45 | F34: 1433.9 | G34: of:=([.F34]-[.F33])/[.F33] -> 0.0119266055045872 | H34: 1300 | I34: 1.124 | J34: 0.8897 | K34: of:=[.F34]*[.I34] -> 1611.7036 | L34: of:=[.F34]*[.J34] -> 1275.74083 | M34: of:=MAX(([.K34]-[.H34]);0) -> 311.7036 | N34: of:=MAX(([.L34]-[.H34]);0) -> 0 | O34: 0.0187123287671233 | P34: of:=POWER(([.O34]/100)+1;365)-1 -> 0.0706796251526887 | Q34: of:=(EXP([.P34]*0.25)-[.J34])/([.I34]-[.J34]) -> 0.546849947324087 | R34: of:=EXP(-[.P34]*0.25)*([.Q34]*[.M34]+(1-[.Q34])*[.N34]) -> 167.469625824198 | S34: of:=[.E34]-[.R34] -> -4.01962582419822 | Y34: Annualized Volatility | Z34: of:=[.Z33]*SQRT(252) -> 0.324008397046322
A35: PVR | B35: 2018-11-20 | C35: 2018-12-27 | D35: CE | E35: 138.9 | F35: 1403.9 | G35: of:=([.F35]-[.F34])/[.F34] -> -0.0209219610851524 | H35: 1300 | I35: 1.124 | J35: 0.8897 | K35: of:=[.F35]*[.I35] -> 1577.9836 | L35: of:=[.F35]*[.J35] -> 1249.04983 | M35: of:=MAX(([.K35]-[.H35]);0) -> 277.9836 | N35: of:=MAX(([.L35]-[.H35]);0) -> 0 | O35: 0.0185753424657534 | P35: of:=POWER(([.O35]/100)+1;365)-1 -> 0.0701445188920717 | Q35: of:=(EXP([.P35]*0.25)-[.J35])/([.I35]-[.J35]) -> 0.54626884495484 | R35: of:=EXP(-[.P35]*0.25)*([.Q35]*[.M35]+(1-[.Q35])*[.N35]) -> 149.214065337806 | S35: of:=[.E35]-[.R35] -> -10.3140653378062 | Y35: Upwards | Z35: of:=EXP([.Z34]*SQRT(0.25)) -> 1.17586517820782
A36: PVR | B36: 2018-11-21 | C36: 2018-12-27 | D36: CE | E36: 147.85 | F36: 1418 | G36: of:=([.F36]-[.F35])/[.F35] -> 0.0100434503882042 | H36: 1300 | I36: 1.124 | J36: 0.8897 | K36: of:=[.F36]*[.I36] -> 1593.832 | L36: of:=[.F36]*[.J36] -> 1261.5946 | M36: of:=MAX(([.K36]-[.H36]);0) -> 293.832 | N36: of:=MAX(([.L36]-[.H36]);0) -> 0 | O36: 0.0186575342465753 | P36: of:=POWER(([.O36]/100)+1;365)-1 -> 0.0704655506354321 | Q36: of:=(EXP([.P36]*0.25)-[.J36])/([.I36]-[.J36]) -> 0.546617462282585 | R36: of:=EXP(-[.P36]*0.25)*([.Q36]*[.M36]+(1-[.Q36])*[.N36]) -> 157.80904542885 | S36: of:=[.E36]-[.R36] -> -9.95904542884963 | Y36: Downwards | Z36: of:=1/[.Z35] -> 0.850437633950634
A37: PVR | B37: 2018-11-22 | C37: 2018-12-27 | D37: CE | E37: 143.75 | F37: 1415.75 | G37: of:=([.F37]-[.F36])/[.F36] -> -0.0015867418899859 | H37: 1300 | I37: 1.124 | J37: 0.8897 | K37: of:=[.F37]*[.I37] -> 1591.303 | L37: of:=[.F37]*[.J37] -> 1259.592775 | M37: of:=MAX(([.K37]-[.H37]);0) -> 291.303 | N37: of:=MAX(([.L37]-[.H37]);0) -> 0 | O37: 0.0185479452054795 | P37: of:=POWER(([.O37]/100)+1;365)-1 -> 0.070037529648749 | Q37: of:=(EXP([.P37]*0.25)-[.J37])/([.I37]-[.J37]) -> 0.546152668566169 | R37: of:=EXP(-[.P37]*0.25)*([.Q37]*[.M37]+(1-[.Q37])*[.N37]) -> 156.334485642461 | S37: of:=[.E37]-[.R37] -> -12.584485642461
A38: PVR | B38: 2018-11-26 | C38: 2018-12-27 | D38: CE | E38: 157.15 | F38: 1436.5 | G38: of:=([.F38]-[.F37])/[.F37] -> 0.0146565424686562 | H38: 1300 | I38: 1.124 | J38: 0.8897 | K38: of:=[.F38]*[.I38] -> 1614.626 | L38: of:=[.F38]*[.J38] -> 1278.05405 | M38: of:=MAX(([.K38]-[.H38]);0) -> 314.626 | N38: of:=MAX(([.L38]-[.H38]);0) -> 0 | O38: 0.0184931506849315 | P38: of:=POWER(([.O38]/100)+1;365)-1 -> 0.0698235831622613 | Q38: of:=(EXP([.P38]*0.25)-[.J38])/([.I38]-[.J38]) -> 0.545920359856522 | R38: of:=EXP(-[.P38]*0.25)*([.Q38]*[.M38]+(1-[.Q38])*[.N38]) -> 168.788518435628 | S38: of:=[.E38]-[.R38] -> -11.6385184356284
A39: PVR | B39: 2018-11-27 | C39: 2018-12-27 | D39: CE | E39: 159.75 | F39: 1442 | G39: of:=([.F39]-[.F38])/[.F38] -> 0.00382875043508528 | H39: 1300 | I39: 1.124 | J39: 0.8897 | K39: of:=[.F39]*[.I39] -> 1620.808 | L39: of:=[.F39]*[.J39] -> 1282.9474 | M39: of:=MAX(([.K39]-[.H39]);0) -> 320.808 | N39: of:=MAX(([.L39]-[.H39]);0) -> 0 | O39: 0.0185205479452055 | P39: of:=POWER(([.O39]/100)+1;365)-1 -> 0.0699305510724413 | Q39: of:=(EXP([.P39]*0.25)-[.J39])/([.I39]-[.J39]) -> 0.546036506867389 | R39: of:=EXP(-[.P39]*0.25)*([.Q39]*[.M39]+(1-[.Q39])*[.N39]) -> 172.137010517041 | S39: of:=[.E39]-[.R39] -> -12.3870105170406
A40: PVR | B40: 2018-11-28 | C40: 2018-12-27 | D40: CE | E40: 176.3 | F40: 1461.9 | G40: of:=([.F40]-[.F39])/[.F39] -> 0.0138002773925105 | H40: 1300 | I40: 1.124 | J40: 0.8897 | K40: of:=[.F40]*[.I40] -> 1643.1756 | L40: of:=[.F40]*[.J40] -> 1300.65243 | M40: of:=MAX(([.K40]-[.H40]);0) -> 343.1756 | N40: of:=MAX(([.L40]-[.H40]);0) -> 0.652430000000095 | O40: 0.0184931506849315 | P40: of:=POWER(([.O40]/100)+1;365)-1 -> 0.0698235831622613 | Q40: of:=(EXP([.P40]*0.25)-[.J40])/([.I40]-[.J40]) -> 0.545920359856522 | R40: of:=EXP(-[.P40]*0.25)*([.Q40]*[.M40]+(1-[.Q40])*[.N40]) -> 184.395751562949 | S40: of:=[.E40]-[.R40] -> -8.09575156294875
A41: PVR | B41: 2018-11-29 | C41: 2018-12-27 | D41: CE | E41: 166.45 | F41: 1452.45 | G41: of:=([.F41]-[.F40])/[.F40] -> -0.00646419043710243 | H41: 1300 | I41: 1.124 | J41: 0.8897 | K41: of:=[.F41]*[.I41] -> 1632.5538 | L41: of:=[.F41]*[.J41] -> 1292.244765 | M41: of:=MAX(([.K41]-[.H41]);0) -> 332.5538 | N41: of:=MAX(([.L41]-[.H41]);0) -> 0 | O41: 0.0185479452054795 | P41: of:=POWER(([.O41]/100)+1;365)-1 -> 0.070037529648749 | Q41: of:=(EXP([.P41]*0.25)-[.J41])/([.I41]-[.J41]) -> 0.546152668566169 | R41: of:=EXP(-[.P41]*0.25)*([.Q41]*[.M41]+(1-[.Q41])*[.N41]) -> 178.472680581545 | S41: of:=[.E41]-[.R41] -> -12.0226805815452
A42: PVR | B42: 2018-11-30 | C42: 2018-12-27 | D42: CE | E42: 178.05 | F42: 1436 | G42: of:=([.F42]-[.F41])/[.F41] -> -0.0113256910737031 | H42: 1300 | I42: 1.124 | J42: 0.8897 | K42: of:=[.F42]*[.I42] -> 1614.064 | L42: of:=[.F42]*[.J42] -> 1277.6092 | M42: of:=MAX(([.K42]-[.H42]);0) -> 314.064 | N42: of:=MAX(([.L42]-[.H42]);0) -> 0 | O42: 0.0185205479452055 | P42: of:=POWER(([.O42]/100)+1;365)-1 -> 0.0699305510724413 | Q42: of:=(EXP([.P42]*0.25)-[.J42])/([.I42]-[.J42]) -> 0.546036506867389 | R42: of:=EXP(-[.P42]*0.25)*([.Q42]*[.M42]+(1-[.Q42])*[.N42]) -> 168.518360112665 | S42: of:=[.E42]-[.R42] -> 9.53163988733502
A43: PVR | B43: 2018-12-03 | C43: 2018-12-27 | D43: CE | E43: 232.7 | F43: 1522 | G43: of:=([.F43]-[.F42])/[.F42] -> 0.0598885793871866 | H43: 1300 | I43: 1.124 | J43: 0.8897 | K43: of:=[.F43]*[.I43] -> 1710.728 | L43: of:=[.F43]*[.J43] -> 1354.1234 | M43: of:=MAX(([.K43]-[.H43]);0) -> 410.728 | N43: of:=MAX(([.L43]-[.H43]);0) -> 54.1234000000002 | O43: 0.0184109589041096 | P43: of:=POWER(([.O43]/100)+1;365)-1 -> 0.0695027434171907 | Q43: of:=(EXP([.P43]*0.25)-[.J43])/([.I43]-[.J43]) -> 0.545572006929013 | R43: of:=EXP(-[.P43]*0.25)*([.Q43]*[.M43]+(1-[.Q43])*[.N43]) -> 244.393278918992 | S43: of:=[.E43]-[.R43] -> -11.6932789189924
A44: PVR | B44: 2018-12-04 | C44: 2018-12-27 | D44: CE | E44: 199.8 | F44: 1487.2 | G44: of:=([.F44]-[.F43])/[.F43] -> -0.0228646517739816 | H44: 1300 | I44: 1.124 | J44: 0.8897 | K44: of:=[.F44]*[.I44] -> 1671.6128 | L44: of:=[.F44]*[.J44] -> 1323.16184 | M44: of:=MAX(([.K44]-[.H44]);0) -> 371.6128 | N44: of:=MAX(([.L44]-[.H44]);0) -> 23.1618400000002 | O44: 0.0183835616438356 | P44: of:=POWER(([.O44]/100)+1;365)-1 -> 0.0693958181604846 | Q44: of:=(EXP([.P44]*0.25)-[.J44])/([.I44]-[.J44]) -> 0.545455918647697 | R44: of:=EXP(-[.P44]*0.25)*([.Q44]*[.M44]+(1-[.Q44])*[.N44]) -> 209.559126355868 | S44: of:=[.E44]-[.R44] -> -9.75912635586792
A45: PVR | B45: 2018-12-05 | C45: 2018-12-27 | D45: CE | E45: 190.35 | F45: 1478.45 | G45: of:=([.F45]-[.F44])/[.F44] -> -0.00588353953738569 | H45: 1300 | I45: 1.124 | J45: 0.8897 | K45: of:=[.F45]*[.I45] -> 1661.7778 | L45: of:=[.F45]*[.J45] -> 1315.376965 | M45: of:=MAX(([.K45]-[.H45]);0) -> 361.7778 | N45: of:=MAX(([.L45]-[.H45]);0) -> 15.3769650000002 | O45: 0.0183287671232877 | P45: of:=POWER(([.O45]/100)+1;365)-1 -> 0.0691819996283183 | Q45: of:=(EXP([.P45]*0.25)-[.J45])/([.I45]-[.J45]) -> 0.545223786114011 | R45: of:=EXP(-[.P45]*0.25)*([.Q45]*[.M45]+(1-[.Q45])*[.N45]) -> 200.740828706412 | S45: of:=[.E45]-[.R45] -> -10.3908287064119
A46: PVR | B46: 2018-12-06 | C46: 2018-12-27 | D46: CE | E46: 200.5 | F46: 1490.85 | G46: of:=([.F46]-[.F45])/[.F45] -> 0.00838716223071451 | H46: 1300 | I46: 1.124 | J46: 0.8897 | K46: of:=[.F46]*[.I46] -> 1675.7154 | L46: of:=[.F46]*[.J46] -> 1326.409245 | M46: of:=MAX(([.K46]-[.H46]);0) -> 375.7154 | N46: of:=MAX(([.L46]-[.H46]);0) -> 26.4092450000001 | O46: 0.0183835616438356 | P46: of:=POWER(([.O46]/100)+1;365)-1 -> 0.0693958181604846 | Q46: of:=(EXP([.P46]*0.25)-[.J46])/([.I46]-[.J46]) -> 0.545455918647697 | R46: of:=EXP(-[.P46]*0.25)*([.Q46]*[.M46]+(1-[.Q46])*[.N46]) -> 213.209126355868 | S46: of:=[.E46]-[.R46] -> -12.7091263558678
A47: PVR | B47: 2018-12-07 | C47: 2018-12-27 | D47: CE | E47: 194.4 | F47: 1485.6 | G47: of:=([.F47]-[.F46])/[.F46] -> -0.00352148103430929 | H47: 1300 | I47: 1.124 | J47: 0.8897 | K47: of:=[.F47]*[.I47] -> 1669.8144 | L47: of:=[.F47]*[.J47] -> 1321.73832 | M47: of:=MAX(([.K47]-[.H47]);0) -> 369.8144 | N47: of:=MAX(([.L47]-[.H47]);0) -> 21.7383199999999 | O47: 0.0183835616438356 | P47: of:=POWER(([.O47]/100)+1;365)-1 -> 0.0693958181604846 | Q47: of:=(EXP([.P47]*0.25)-[.J47])/([.I47]-[.J47]) -> 0.545455918647697 | R47: of:=EXP(-[.P47]*0.25)*([.Q47]*[.M47]+(1-[.Q47])*[.N47]) -> 207.959126355868 | S47: of:=[.E47]-[.R47] -> -13.5591263558677
A48: PVR | B48: 2018-12-10 | C48: 2018-12-27 | D48: CE | E48: 184.1 | F48: 1477.1 | G48: of:=([.F48]-[.F47])/[.F47] -> -0.00572159396876683 | H48: 1300 | I48: 1.124 | J48: 0.8897 | K48: of:=[.F48]*[.I48] -> 1660.2604 | L48: of:=[.F48]*[.J48] -> 1314.17587 | M48: of:=MAX(([.K48]-[.H48]);0) -> 360.2604 | N48: of:=MAX(([.L48]-[.H48]);0) -> 14.17587 | O48: 0.0183561643835616 | P48: of:=POWER(([.O48]/100)+1;365)-1 -> 0.0692889035646049 | Q48: of:=(EXP([.P48]*0.25)-[.J48])/([.I48]-[.J48]) -> 0.545339845043479 | R48: of:=EXP(-[.P48]*0.25)*([.Q48]*[.M48]+(1-[.Q48])*[.N48]) -> 199.424976285056 | S48: of:=[.E48]-[.R48] -> -15.3249762850561
A49: PVR | B49: 2018-12-11 | C49: 2018-12-27 | D49: CE | E49: 205.7 | F49: 1500.25 | G49: of:=([.F49]-[.F48])/[.F48] -> 0.0156726017195857 | H49: 1300 | I49: 1.124 | J49: 0.8897 | K49: of:=[.F49]*[.I49] -> 1686.281 | L49: of:=[.F49]*[.J49] -> 1334.772425 | M49: of:=MAX(([.K49]-[.H49]);0) -> 386.281 | N49: of:=MAX(([.L49]-[.H49]);0) -> 34.7724250000001 | O49: 0.0183561643835616 | P49: of:=POWER(([.O49]/100)+1;365)-1 -> 0.0692889035646049 | Q49: of:=(EXP([.P49]*0.25)-[.J49])/([.I49]-[.J49]) -> 0.545339845043479 | R49: of:=EXP(-[.P49]*0.25)*([.Q49]*[.M49]+(1-[.Q49])*[.N49]) -> 222.574976285056 | S49: of:=[.E49]-[.R49] -> -16.8749762850562
A50: PVR | B50: 2018-12-12 | C50: 2018-12-27 | D50: CE | E50: 248.75 | F50: 1544.4 | G50: of:=([.F50]-[.F49])/[.F49] -> 0.0294284285952342 | H50: 1300 | I50: 1.124 | J50: 0.8897 | K50: of:=[.F50]*[.I50] -> 1735.9056 | L50: of:=[.F50]*[.J50] -> 1374.05268 | M50: of:=MAX(([.K50]-[.H50]);0) -> 435.9056 | N50: of:=MAX(([.L50]-[.H50]);0) -> 74.0526800000002 | O50: 0.0183013698630137 | P50: of:=POWER(([.O50]/100)+1;365)-1 -> 0.0690751063506516 | Q50: of:=(EXP([.P50]*0.25)-[.J50])/([.I50]-[.J50]) -> 0.545107741857225 | R50: of:=EXP(-[.P50]*0.25)*([.Q50]*[.M50]+(1-[.Q50])*[.N50]) -> 266.656683619873 | S50: of:=[.E50]-[.R50] -> -17.9066836198728
A51: PVR | B51: 2018-12-13 | C51: 2018-12-27 | D51: CE | E51: 239.1 | F51: 1535.1 | G51: of:=([.F51]-[.F50])/[.F50] -> -0.00602175602175614 | H51: 1300 | I51: 1.124 | J51: 0.8897 | K51: of:=[.F51]*[.I51] -> 1725.4524 | L51: of:=[.F51]*[.J51] -> 1365.77847 | M51: of:=MAX(([.K51]-[.H51]);0) -> 425.4524 | N51: of:=MAX(([.L51]-[.H51]);0) -> 65.77847 | O51: 0.0183835616438356 | P51: of:=POWER(([.O51]/100)+1;365)-1 -> 0.0693958181604846 | Q51: of:=(EXP([.P51]*0.25)-[.J51])/([.I51]-[.J51]) -> 0.545455918647697 | R51: of:=EXP(-[.P51]*0.25)*([.Q51]*[.M51]+(1-[.Q51])*[.N51]) -> 257.459126355868 | S51: of:=[.E51]-[.R51] -> -18.3591263558679
A52: PVR | B52: 2018-12-14 | C52: 2018-12-27 | D52: CE | E52: 260.85 | F52: 1557.4 | G52: of:=([.F52]-[.F51])/[.F51] -> 0.0145267409289298 | H52: 1300 | I52: 1.124 | J52: 0.8897 | K52: of:=[.F52]*[.I52] -> 1750.5176 | L52: of:=[.F52]*[.J52] -> 1385.61878 | M52: of:=MAX(([.K52]-[.H52]);0) -> 450.5176 | N52: of:=MAX(([.L52]-[.H52]);0) -> 85.6187800000003 | O52: 0.0183561643835616 | P52: of:=POWER(([.O52]/100)+1;365)-1 -> 0.0692889035646049 | Q52: of:=(EXP([.P52]*0.25)-[.J52])/([.I52]-[.J52]) -> 0.545339845043479 | R52: of:=EXP(-[.P52]*0.25)*([.Q52]*[.M52]+(1-[.Q52])*[.N52]) -> 279.724976285056 | S52: of:=[.E52]-[.R52] -> -18.8749762850563
A53: PVR | B53: 2018-12-17 | C53: 2018-12-27 | D53: CE | E53: 264.6 | F53: 1562 | G53: of:=([.F53]-[.F52])/[.F52] -> 0.00295364068318987 | H53: 1300 | I53: 1.124 | J53: 0.8897 | K53: of:=[.F53]*[.I53] -> 1755.688 | L53: of:=[.F53]*[.J53] -> 1389.7114 | M53: of:=MAX(([.K53]-[.H53]);0) -> 455.688 | N53: of:=MAX(([.L53]-[.H53]);0) -> 89.7114000000001 | O53: 0.0182191780821918 | P53: of:=POWER(([.O53]/100)+1;365)-1 -> 0.0687544904589459 | Q53: of:=(EXP([.P53]*0.25)-[.J53])/([.I53]-[.J53]) -> 0.544759697101537 | R53: of:=EXP(-[.P53]*0.25)*([.Q53]*[.M53]+(1-[.Q53])*[.N53]) -> 284.154263312042 | S53: of:=[.E53]-[.R53] -> -19.5542633120422
A54: PVR | B54: 2018-12-18 | C54: 2018-12-27 | D54: CE | E54: 257.8 | F54: 1555.5 | G54: of:=([.F54]-[.F53])/[.F53] -> -0.00416133162612036 | H54: 1300 | I54: 1.124 | J54: 0.8897 | K54: of:=[.F54]*[.I54] -> 1748.382 | L54: of:=[.F54]*[.J54] -> 1383.92835 | M54: of:=MAX(([.K54]-[.H54]);0) -> 448.382 | N54: of:=MAX(([.L54]-[.H54]);0) -> 83.9283500000001 | O54: 0.0181643835616438 | P54: of:=POWER(([.O54]/100)+1;365)-1 -> 0.0685407998046994 | Q54: of:=(EXP([.P54]*0.25)-[.J54])/([.I54]-[.J54]) -> 0.544527740588088 | R54: of:=EXP(-[.P54]*0.25)*([.Q54]*[.M54]+(1-[.Q54])*[.N54]) -> 277.585995565661 | S54: of:=[.E54]-[.R54] -> -19.7859955656613
A55: PVR | B55: 2018-12-19 | C55: 2018-12-27 | D55: CE | E55: 256.65 | F55: 1554.6 | G55: of:=([.F55]-[.F54])/[.F54] -> -0.000578592092574793 | H55: 1300 | I55: 1.124 | J55: 0.8897 | K55: of:=[.F55]*[.I55] -> 1747.3704 | L55: of:=[.F55]*[.J55] -> 1383.12762 | M55: of:=MAX(([.K55]-[.H55]);0) -> 447.3704 | N55: of:=MAX(([.L55]-[.H55]);0) -> 83.12762 | O55: 0.0181643835616438 | P55: of:=POWER(([.O55]/100)+1;365)-1 -> 0.0685407998046994 | Q55: of:=(EXP([.P55]*0.25)-[.J55])/([.I55]-[.J55]) -> 0.544527740588088 | R55: of:=EXP(-[.P55]*0.25)*([.Q55]*[.M55]+(1-[.Q55])*[.N55]) -> 276.685995565661 | S55: of:=[.E55]-[.R55] -> -20.0359955656613
A56: PVR | B56: 2018-12-20 | C56: 2018-12-27 | D56: CE | E56: 289.55 | F56: 1573.2 | G56: of:=([.F56]-[.F55])/[.F55] -> 0.0119644924739484 | H56: 1300 | I56: 1.124 | J56: 0.8897 | K56: of:=[.F56]*[.I56] -> 1768.2768 | L56: of:=[.F56]*[.J56] -> 1399.67604 | M56: of:=MAX(([.K56]-[.H56]);0) -> 468.2768 | N56: of:=MAX(([.L56]-[.H56]);0) -> 99.6760400000001 | O56: 0.0182465753424658 | P56: of:=POWER(([.O56]/100)+1;365)-1 -> 0.0688613517670249 | Q56: of:=(EXP([.P56]*0.25)-[.J56])/([.I56]-[.J56]) -> 0.544875697353148 | R56: of:=EXP(-[.P56]*0.25)*([.Q56]*[.M56]+(1-[.Q56])*[.N56]) -> 295.388400922778 | S56: of:=[.E56]-[.R56] -> -5.83840092277802
A57: PVR | B57: 2018-12-21 | C57: 2018-12-27 | D57: CE | E57: 266.05 | F57: 1564.5 | G57: of:=([.F57]-[.F56])/[.F56] -> -0.00553012967200613 | H57: 1300 | I57: 1.124 | J57: 0.8897 | K57: of:=[.F57]*[.I57] -> 1758.498 | L57: of:=[.F57]*[.J57] -> 1391.93565 | M57: of:=MAX(([.K57]-[.H57]);0) -> 458.498 | N57: of:=MAX(([.L57]-[.H57]);0) -> 91.9356500000001 | O57: 0.0182465753424658 | P57: of:=POWER(([.O57]/100)+1;365)-1 -> 0.0688613517670249 | Q57: of:=(EXP([.P57]*0.25)-[.J57])/([.I57]-[.J57]) -> 0.544875697353148 | R57: of:=EXP(-[.P57]*0.25)*([.Q57]*[.M57]+(1-[.Q57])*[.N57]) -> 286.688400922778 | S57: of:=[.E57]-[.R57] -> -20.638400922778
A58: PVR | B58: 2018-12-24 | C58: 2018-12-27 | D58: CE | E58: 244.5 | F58: 1543.7 | G58: of:=([.F58]-[.F57])/[.F57] -> -0.0132949824224992 | H58: 1300 | I58: 1.124 | J58: 0.8897 | K58: of:=[.F58]*[.I58] -> 1735.1188 | L58: of:=[.F58]*[.J58] -> 1373.42989 | M58: of:=MAX(([.K58]-[.H58]);0) -> 435.1188 | N58: of:=MAX(([.L58]-[.H58]);0) -> 73.4298900000001 | O58: 0.0182739726027397 | P58: of:=POWER(([.O58]/100)+1;365)-1 -> 0.0689682237306315 | Q58: of:=(EXP([.P58]*0.25)-[.J58])/([.I58]-[.J58]) -> 0.544991712271053 | R58: of:=EXP(-[.P58]*0.25)*([.Q58]*[.M58]+(1-[.Q58])*[.N58]) -> 265.922541025376 | S58: of:=[.E58]-[.R58] -> -21.4225410253765
A59: PVR | B59: 2018-12-26 | C59: 2018-12-27 | D59: CE | E59: 249 | F59: 1548.7 | G59: of:=([.F59]-[.F58])/[.F58] -> 0.00323897130271426 | H59: 1300 | I59: 1.124 | J59: 0.8897 | K59: of:=[.F59]*[.I59] -> 1740.7388 | L59: of:=[.F59]*[.J59] -> 1377.87839 | M59: of:=MAX(([.K59]-[.H59]);0) -> 440.7388 | N59: of:=MAX(([.L59]-[.H59]);0) -> 77.8783900000001 | O59: 0.0182739726027397 | P59: of:=POWER(([.O59]/100)+1;365)-1 -> 0.0689682237306315 | Q59: of:=(EXP([.P59]*0.25)-[.J59])/([.I59]-[.J59]) -> 0.544991712271053 | R59: of:=EXP(-[.P59]*0.25)*([.Q59]*[.M59]+(1-[.Q59])*[.N59]) -> 270.922541025377 | S59: of:=[.E59]-[.R59] -> -21.9225410253765
A60: PVR | B60: 2018-12-27 | C60: 2018-12-27 | D60: CE | E60: 0 | F60: 1583.65 | G60: of:=([.F60]-[.F59])/[.F59] -> 0.0225673145218571 | H60: 1300 | I60: 1.124 | J60: 0.8897 | K60: of:=[.F60]*[.I60] -> 1780.0226 | L60: of:=[.F60]*[.J60] -> 1408.973405 | M60: of:=MAX(([.K60]-[.H60]);0) -> 480.0226 | N60: of:=MAX(([.L60]-[.H60]);0) -> 108.973405 | O60: 0.0182739726027397 | P60: of:=POWER(([.O60]/100)+1;365)-1 -> 0.0689682237306315 | Q60: of:=(EXP([.P60]*0.25)-[.J60])/([.I60]-[.J60]) -> 0.544991712271053 | R60: of:=EXP(-[.P60]*0.25)*([.Q60]*[.M60]+(1-[.Q60])*[.N60]) -> 305.872541025376 | S60: of:=[.E60]-[.R60] -> -305.872541025376